{"$schema":"https://json-schema.org/draft/2020-12/schema","$id":"https://raw.githubusercontent.com/cyber-sentinel/Cyber-Sentinel-Atlas/main/schemas/ingestion/v1/parser-definition.schema.json","title":"ParserDefinition","type":"object","additionalProperties":false,"required":["ingestion_contract_version","parser_id","parser_version","status","purpose","supported_media_types","unknown_field_policy","security_policy"],"properties":{"ingestion_contract_version":{"$ref":"https://raw.githubusercontent.com/cyber-sentinel/Cyber-Sentinel-Atlas/main/schemas/ingestion/v1/defs/common.schema.json#/$defs/contract_version"},"parser_id":{"$ref":"https://raw.githubusercontent.com/cyber-sentinel/Cyber-Sentinel-Atlas/main/schemas/ingestion/v1/defs/common.schema.json#/$defs/artifact_id"},"parser_version":{"$ref":"https://raw.githubusercontent.com/cyber-sentinel/Cyber-Sentinel-Atlas/main/schemas/ingestion/v1/defs/common.schema.json#/$defs/semver"},"status":{"$ref":"https://raw.githubusercontent.com/cyber-sentinel/Cyber-Sentinel-Atlas/main/schemas/ingestion/v1/defs/common.schema.json#/$defs/status"},"purpose":{"type":"string","minLength":1},"supported_media_types":{"type":"array","minItems":1,"uniqueItems":true,"items":{"type":"string","minLength":1}},"unknown_field_policy":{"const":"preserve-and-report"},"security_policy":{"$ref":"https://raw.githubusercontent.com/cyber-sentinel/Cyber-Sentinel-Atlas/main/schemas/ingestion/v1/defs/common.schema.json#/$defs/parser_security"}}}
