{
  "ingestion_contract_version": "1.0.0",
  "parser_id": "atlas:parser:atlas.ingestion:microsoft-windows-security-event-html",
  "parser_version": "1.0.1",
  "status": "active",
  "purpose": "Parse a local immutable Microsoft Learn Windows Security event HTML snapshot into source-native structural event documentation facts without semantic normalization or source execution.",
  "supported_media_types": ["text/html"],
  "unknown_field_policy": "preserve-and-report",
  "security_policy": {
    "network_access": false,
    "dns_access": false,
    "http_access": false,
    "git_access": false,
    "source_execution": false,
    "javascript_execution": false,
    "xml_external_entities": false,
    "dtd_external_resolution": false,
    "macros": false,
    "ai_enabled": false,
    "filesystem_mode": "restricted",
    "input_mode": "read-only",
    "output_mode": "designated-only",
    "resource_limits": {
      "cpu_seconds": 30,
      "memory_bytes": 268435456,
      "wall_seconds": 60,
      "max_output_records": 1000
    }
  }
}
